{
  "schema_version": "1.0",
  "message_type": "task_draft",
  "created_at": "2026-07-18T10:00:00Z",
  "safety_flags": {
    "synthetic_local_only": true,
    "mock_only": true,
    "dry_run": true,
    "owner_review_required": true,
    "external_side_effects_allowed": false,
    "external_side_effects_occurred": false,
    "blackboard_write_allowed": false,
    "queue_write_allowed": false,
    "audit_trail_write_allowed": false,
    "worker_dispatch_allowed": false,
    "openclaw_call_allowed": false,
    "hermes_runtime_allowed": false,
    "connector_call_allowed": false,
    "google_sheets_write_allowed": false,
    "follow_up_allowed": false,
    "follow_up_requires_owner_confirmation": true
  },
  "prev_entry_hash": null,
  "execution_class": "AUTO",
  "produced_by": "gpt-5.6-sol",
  "parent_task_id": null,
  "role": "planner",
  "task_id": "task-phase3-001",
  "title": "Read synthetic adapter status",
  "summary": "Prepare a harmless read-only query for the synthetic adapter status.",
  "requested_by": "owner",
  "task_type": "query",
  "target_runtime": "openclaw_mock"
}
